<?xml version="1.0" encoding="UTF-8"?>
<!--
To change this license header, choose License Headers in Project Properties.
To change this template file, choose Tools | Templates
and open the template in the editor.
-->


<profil
    xmlns:xsi='http://www.w3.org/2001/XMLSchema-instance'
    xsi:noNamespaceSchemaLocation='../../../src/pro_tux/profil.xsd'>
    <nom></nom>
    <avatar></avatar>
    <anniversaire></anniversaire>
    <parties>
        <partie date="" trouvé="">
            <mot niveau=""></mot>
            <temps></temps>
        </partie>
        <partie date="" trouvé="">
            <mot niveau=""></mot>
            <temps></temps>
        </partie>
        <partie date="" trouvé="">
            <mot niveau=""></mot>
            <temps></temps>
        </partie>
    </parties>

</profil>
